Running on 1 MPI rank(s)...
   Number of active cells:       1600
   Number of degrees of freedom: 8228
   Volume of triangulation:      1600
Initial refinement around IB particles - Step : 1 of 3
   Number of active cells:       2160
   Number of degrees of freedom: 11244
   Volume of triangulation:      1600
Initial refinement around IB particles - Step : 2 of 3
   Number of active cells:       4876
   Number of degrees of freedom: 24588
   Volume of triangulation:      1600
Initial refinement around IB particles - Step : 3 of 3
   Number of active cells:       4876
   Number of degrees of freedom: 24588
   Volume of triangulation:      1600

*****************************************************************
Transient iteration : 1        Time : 0.025    Time step : 0.025    CFL : 0       
*****************************************************************
particule 0 position 5 12.7256 4.99988
particule 0 velocity 2.04878e-05 -0.975637 -0.00472526
particule 1 position 5 11.0307 4.99989
particule 1 velocity 0.000198446 1.22664 -0.00424002
+------------------------------------------+
|  Force  summary particles                |
+------------------------------------------+
<<<<<<< HEAD
particle_ID  time    T_x    omega_x    T_y     omega_y    T_z    omega_z    f_x      v_x      p_x      f_y       v_y       p_y       f_z      v_z    p_z     f_xv     f_yv     f_zv      f_xp      f_yp     f_zp    
0           0.0250 0.000123 0.000003 0.000004 0.000000 0.000109 0.000002 0.000030 0.000020 5.000001 0.092020 -0.975637 12.725609 -0.000367 -0.0047 4.9999 0.000033 0.021196 -0.000055 -0.000003 0.070824 -0.000312 
+------------------------------------------+
|  Force  summary particle 1               |
+------------------------------------------+
particle_ID  time     T_x    omega_x     T_y     omega_y     T_z     omega_z     f_x      v_x      p_x       f_y      v_y       p_y       f_z      v_z    p_z     f_xv      f_yv      f_zv     f_xp      f_yp      f_zp    
1           0.0250 -0.000073 0.000001 -0.000008 0.000000 -0.000089 -0.000001 -0.000040 0.000198 5.000005 -0.089843 1.226642 11.030666 -0.000269 -0.0042 4.9999 -0.000029 -0.022613 0.000049 -0.000010 -0.067230 -0.000318 
=======
particle_ID  time     T_x    omega_x     T_y     omega_y     T_z     omega_z     f_x      v_x      p_x       f_y       v_y       p_y       f_z      v_z    p_z
0           0.0250 0.000123  0.000003 0.000004  0.000000 0.000109  0.000002  0.000030  0.000020 5.000001 0.092020  -0.975637 12.725609 -0.000367 -0.0047 4.9999
1           0.0250 -0.000073 0.000001 -0.000008 0.000000 -0.000089 -0.000001 -0.000040 0.000198 5.000005 -0.089843 1.226642  11.030666 -0.000269 -0.0042 4.9999
>>>>>>> master

*****************************************************************
Transient iteration : 2        Time : 0.05     Time step : 0.025    CFL : 0.0988676
*****************************************************************
   Number of active cells:       4106
   Number of degrees of freedom: 21052
   Volume of triangulation:      1600
particule 0 position 4.99995 12.6851 4.99946
particule 0 velocity -0.00188457 -1.61987 -0.0168244
particule 1 position 5.00002 11.0854 4.99961
particule 1 velocity 0.000751014 2.18944 -0.0111702
+------------------------------------------+
<<<<<<< HEAD
|  Force  summary particle 0               |
+------------------------------------------+
particle_ID  time    T_x    omega_x    T_y     omega_y     T_z     omega_z     f_x       v_x      p_x      f_y       v_y       p_y       f_z      v_z    p_z     f_xv      f_yv     f_zv      f_xp      f_yp     f_zp    
0           0.0250 0.000123 0.000003 0.000004 0.000000 0.000109  0.000002  0.000030  0.000020  5.000001 0.092020 -0.975637 12.725609 -0.000367 -0.0047 4.9999 0.000033  0.021196 -0.000055 -0.000003 0.070824 -0.000312 
0           0.0500 0.000267 0.000009 0.000031 0.000000  -0.000145 -0.000001 -0.000156 -0.001885 4.999953 0.096714 -1.619873 12.685112 -0.000939 -0.0168 4.9995 -0.000095 0.033280 -0.000306 -0.000061 0.063434 -0.000633 
+------------------------------------------+
|  Force  summary particle 1               |
+------------------------------------------+
particle_ID  time     T_x     omega_x     T_y     omega_y     T_z     omega_z     f_x      v_x      p_x       f_y      v_y       p_y       f_z      v_z    p_z     f_xv      f_yv      f_zv     f_xp      f_yp      f_zp    
1           0.0250 -0.000073 0.000001  -0.000008 0.000000 -0.000089 -0.000001 -0.000040 0.000198 5.000005 -0.089843 1.226642 11.030666 -0.000269 -0.0042 4.9999 -0.000029 -0.022613 0.000049 -0.000010 -0.067230 -0.000318 
1           0.0500 -0.000026 -0.000001 -0.000026 0.000000 -0.000160 -0.000003 -0.000087 0.000751 5.000024 -0.085534 2.189443 11.085402 -0.000444 -0.0112 4.9996 0.000026  -0.033889 0.000243 -0.000112 -0.051645 -0.000687 
=======
|  Force  summary particles                |
+------------------------------------------+
particle_ID  time     T_x     omega_x     T_y     omega_y     T_z     omega_z     f_x       v_x      p_x       f_y       v_y       p_y       f_z      v_z    p_z
0           0.0500 0.000267  0.000009  0.000031  0.000000  -0.000145 -0.000001 -0.000156 -0.001885 4.999953 0.096714  -1.619873 12.685112 -0.000939 -0.0168 4.9995
1           0.0500 -0.000026 -0.000001 -0.000026 0.000000 -0.000160 -0.000003 -0.000087 0.000751  5.000024 -0.085534 2.189443  11.085402 -0.000444 -0.0112 4.9996
>>>>>>> master

*****************************************************************
Transient iteration : 3        Time : 0.075    Time step : 0.025    CFL : 0.176471
*****************************************************************
   Number of active cells:       3938
   Number of degrees of freedom: 20172
   Volume of triangulation:      1600
particule 0 position 4.99974 12.6576 4.99919
particule 0 velocity -0.00669154 1.38009 0.000642582
particule 1 position 5.00006 11.122 4.9995
particule 1 velocity -0.000830193 -1.61489 0.00564043
+------------------------------------------+
<<<<<<< HEAD
|  Force  summary particle 0               |
+------------------------------------------+
particle_ID  time    T_x    omega_x    T_y     omega_y     T_z     omega_z     f_x       v_x      p_x       f_y       v_y       p_y       f_z      v_z    p_z     f_xv      f_yv      f_zv      f_xp      f_yp      f_zp    
0           0.0250 0.000123 0.000003 0.000004 0.000000 0.000109  0.000002  0.000030  0.000020  5.000001 0.092020  -0.975637 12.725609 -0.000367 -0.0047 4.9999 0.000033  0.021196  -0.000055 -0.000003 0.070824  -0.000312 
0           0.0500 0.000267 0.000009 0.000031 0.000000  -0.000145 -0.000001 -0.000156 -0.001885 4.999953 0.096714  -1.619873 12.685112 -0.000939 -0.0168 4.9995 -0.000095 0.033280  -0.000306 -0.000061 0.063434  -0.000633 
0           0.0750 0.000080 0.000009 0.000015 0.000000  0.000591  -0.000008 0.001207  -0.006692 4.999742 -0.136099 1.380090  12.657632 0.001859  0.0006  4.9992 0.000925  -0.032097 0.000065  0.000283  -0.104002 0.001794  
+------------------------------------------+
|  Force  summary particle 1               |
+------------------------------------------+
particle_ID  time     T_x     omega_x     T_y     omega_y     T_z     omega_z     f_x       v_x      p_x       f_y       v_y       p_y       f_z      v_z    p_z     f_xv      f_yv      f_zv      f_xp      f_yp      f_zp    
1           0.0250 -0.000073 0.000001  -0.000008 0.000000 -0.000089 -0.000001 -0.000040 0.000198  5.000005 -0.089843 1.226642  11.030666 -0.000269 -0.0042 4.9999 -0.000029 -0.022613 0.000049  -0.000010 -0.067230 -0.000318 
1           0.0500 -0.000026 -0.000001 -0.000026 0.000000 -0.000160 -0.000003 -0.000087 0.000751  5.000024 -0.085534 2.189443  11.085402 -0.000444 -0.0112 4.9996 0.000026  -0.033889 0.000243  -0.000112 -0.051645 -0.000687 
1           0.0750 0.000076  -0.000004 0.000016  0.000000 0.000163  -0.000004 -0.000026 -0.000830 5.000057 0.127090  -1.614893 11.122023 0.001288  0.0056  4.9995 -0.000059 0.029695  -0.000225 0.000034  0.097395  0.001513  
=======
|  Force  summary particles                |
+------------------------------------------+
particle_ID  time    T_x     omega_x    T_y     omega_y    T_z     omega_z     f_x       v_x      p_x       f_y       v_y       p_y      f_z     v_z    p_z
0           0.0750 0.000080 0.000009  0.000015 0.000000  0.000591 -0.000008 0.001207  -0.006692 4.999742 -0.136099 1.380090  12.657632 0.001859 0.0006 4.9992
1           0.0750 0.000076 -0.000004 0.000016 0.000000 0.000163 -0.000004 -0.000026 -0.000830 5.000057 0.127090  -1.614893 11.122023 0.001288 0.0056 4.9995
>>>>>>> master
