Running on 1 MPI rank(s)...
   Number of active cells:       1600
   Number of degrees of freedom: 8228
   Volume of triangulation:      1600
   Number of active cells:       1768
   Number of degrees of freedom: 9276
   Volume of triangulation:      1600
   Number of active cells:       2552
   Number of degrees of freedom: 13440
   Volume of triangulation:      1600
   Number of active cells:       2552
   Number of degrees of freedom: 13440
   Volume of triangulation:      1600

*****************************************************************
Transient iteration : 1        Time : 0.0025   Time step : 0.0025   CFL : 0       
*****************************************************************
particule 0 position 5.0000168493277188 0.79719347460674705 4.9998447850486185
particule 0 velocity 0.0067397310877033607 -9.1226101573011835 -0.062085980552652763
+------------------------------------------+
|  Force  summary particle 0               |
+------------------------------------------+
particle_ID  time    T_x    omega_x     T_y     omega_y    T_z    omega_z    f_x      v_x      p_x      f_y       v_y      p_y       f_z      v_z    p_z   
0           0.0025 0.000388 0.000001 -0.000004 -0.000000 0.000610 0.000002 0.003766 0.006740 5.000017 2.121787 -9.122610 0.797193 -0.009374 -0.0621 4.9998 

*****************************************************************
Transient iteration : 2        Time : 0.0050000000000000001 Time step : 0.0025000000000000001 CFL : 0.073529956914902689
*****************************************************************
   Number of active cells:       1929
   Number of degrees of freedom: 10824
   Volume of triangulation:      1600
particule 0 position 5.0000411174223673 0.77661722305554559 4.99969596839082
particule 0 velocity 0.0097072378594964502 -8.230500620480651 -0.05952666311925453
+------------------------------------------+
|  Force  summary particle 0               |
+------------------------------------------+
particle_ID  time    T_x    omega_x     T_y     omega_y    T_z    omega_z    f_x      v_x      p_x      f_y       v_y      p_y       f_z      v_z    p_z   
0           0.0025 0.000388 0.000001 -0.000004 -0.000000 0.000610 0.000002 0.003766 0.006740 5.000017 2.121787 -9.122610 0.797193 -0.009374 -0.0621 4.9998 
0           0.0050 0.000375 0.000002 0.000002  -0.000000 0.000338 0.000003 0.002348 0.009707 5.000041 0.867337 -8.230501 0.776617 0.002022  -0.0595 4.9997 

*****************************************************************
Transient iteration : 3        Time : 0.0074999999999999997 Time step : 0.0025000000000000001 CFL : 0.066339299371523802
*****************************************************************
   Number of active cells:       1460
   Number of degrees of freedom: 8304
   Volume of triangulation:      1600
particule 0 position 5.0000623126998427 0.75689915275694397 4.9995530723741002
particule 0 velocity 0.0084781109902858989 -7.8872281194406462 -0.057158406687998542
+------------------------------------------+
|  Force  summary particle 0               |
+------------------------------------------+
particle_ID  time     T_x     omega_x     T_y     omega_y     T_z     omega_z     f_x      v_x      p_x      f_y       v_y      p_y       f_z      v_z    p_z   
0           0.0025 0.000388  0.000001  -0.000004 -0.000000 0.000610  0.000002  0.003766  0.006740 5.000017 2.121787 -9.122610 0.797193 -0.009374 -0.0621 4.9998 
0           0.0050 0.000375  0.000002  0.000002  -0.000000 0.000338  0.000003  0.002348  0.009707 5.000041 0.867337 -8.230501 0.776617 0.002022  -0.0595 4.9997 
0           0.0075 -0.001382 -0.000002 0.000003  0.000000  -0.001599 -0.000001 -0.000948 0.008478 5.000062 0.439935 -7.887228 0.756899 0.001777  -0.0572 4.9996 

*****************************************************************
Transient iteration : 4        Time : 0.01     Time step : 0.0025000000000000001 CFL : 0.063572458972629114
*****************************************************************
   Number of active cells:       1390
   Number of degrees of freedom: 7840
   Volume of triangulation:      1600
particule 0 position 5.0000472706501666 0.7624336694356959 4.9994568932093832
particule 0 velocity 0.0016820103412161693 6.5034161932805112 0.022783893750759503
+------------------------------------------+
|  Force  summary particle 0               |
+------------------------------------------+
particle_ID  time     T_x     omega_x     T_y     omega_y     T_z     omega_z     f_x      v_x      p_x       f_y       v_y      p_y       f_z      v_z    p_z   
0           0.0025 0.000388  0.000001  -0.000004 -0.000000 0.000610  0.000002  0.003766  0.006740 5.000017 2.121787  -9.122610 0.797193 -0.009374 -0.0621 4.9998 
0           0.0050 0.000375  0.000002  0.000002  -0.000000 0.000338  0.000003  0.002348  0.009707 5.000041 0.867337  -8.230501 0.776617 0.002022  -0.0595 4.9997 
0           0.0075 -0.001382 -0.000002 0.000003  0.000000  -0.001599 -0.000001 -0.000948 0.008478 5.000062 0.439935  -7.887228 0.756899 0.001777  -0.0572 4.9996 
0           0.0100 0.000337  -0.000001 -0.000001 -0.000000 -0.001761 -0.000006 -0.011787 0.001682 5.000047 -3.335641 6.503416  0.762434 0.032995  0.0228  4.9995 

*****************************************************************
Transient iteration : 5        Time : 0.012500000000000001 Time step : 0.0025000000000000001 CFL : 0.05241762186106233
*****************************************************************
   Number of active cells:       1390
   Number of degrees of freedom: 7840
   Volume of triangulation:      1600
particule 0 position 5.0000392828977596 0.77536646931279685 4.9994964857082236
particule 0 velocity -0.0031951009629235141 5.1731199508403831 0.015836999536201456
+------------------------------------------+
|  Force  summary particle 0               |
+------------------------------------------+
particle_ID  time     T_x     omega_x     T_y     omega_y     T_z     omega_z     f_x       v_x      p_x       f_y       v_y      p_y       f_z      v_z    p_z   
0           0.0025 0.000388  0.000001  -0.000004 -0.000000 0.000610  0.000002  0.003766  0.006740  5.000017 2.121787  -9.122610 0.797193 -0.009374 -0.0621 4.9998 
0           0.0050 0.000375  0.000002  0.000002  -0.000000 0.000338  0.000003  0.002348  0.009707  5.000041 0.867337  -8.230501 0.776617 0.002022  -0.0595 4.9997 
0           0.0075 -0.001382 -0.000002 0.000003  0.000000  -0.001599 -0.000001 -0.000948 0.008478  5.000062 0.439935  -7.887228 0.756899 0.001777  -0.0572 4.9996 
0           0.0100 0.000337  -0.000001 -0.000001 -0.000000 -0.001761 -0.000006 -0.011787 0.001682  5.000047 -3.335641 6.503416  0.762434 0.032995  0.0228  4.9995 
0           0.0125 0.000722  0.000001  -0.000005 -0.000000 -0.001252 -0.000009 -0.003328 -0.003195 5.000039 -0.861817 5.173120  0.775366 -0.006832 0.0158  4.9995 
